{
  "schema_version": 1,
  "diagram_type": "architecture",
  "meta": {
    "title": "Web shop — system overview",
    "lang": "en",
    "description": "Main user journey left to right: visitor, web app, API, database. Stores and branches sit above or below their owner."
  },
  "layout": { "cols": 4 },
  "nodes": [
    { "id": "visitor", "type": "actor", "label": "Visitor", "sublabel": "browser", "row": 1, "col": 0 },
    { "id": "web", "type": "frontend", "label": "Web app", "sublabel": "Next.js", "row": 1, "col": 1 },
    { "id": "auth", "type": "security", "label": "Auth provider", "sublabel": "OIDC", "row": 0, "col": 1 },
    { "id": "api", "type": "backend", "label": "API", "sublabel": "Node · Fastify", "row": 1, "col": 2 },
    { "id": "cache", "type": "database", "label": "Redis cache", "row": 0, "col": 2 },
    { "id": "db", "type": "database", "label": "Postgres", "sublabel": "orders, users", "row": 1, "col": 3 },
    { "id": "queue", "type": "messagebus", "label": "Job queue", "row": 2, "col": 2 },
    { "id": "worker", "type": "backend", "label": "Worker", "sublabel": "emails, invoices", "row": 2, "col": 3 },
    { "id": "email", "type": "external", "label": "Email API", "row": 3, "col": 3 }
  ],
  "groups": [
    { "id": "vpc", "label": "Cloud (VPC)", "kind": "boundary", "wraps": ["api", "cache", "db", "queue", "worker"] }
  ],
  "edges": [
    { "from": "visitor", "to": "web", "label": "HTTPS", "variant": "emphasis" },
    { "from": "web", "to": "api", "label": "REST", "variant": "emphasis" },
    { "from": "api", "to": "db", "label": "SQL", "variant": "emphasis" },
    { "from": "web", "to": "auth", "label": "login", "variant": "security" },
    { "from": "api", "to": "auth", "label": "verifies JWT", "variant": "security" },
    { "from": "api", "to": "cache", "label": "sessions" },
    { "from": "api", "to": "queue", "label": "enqueues", "variant": "dashed" },
    { "from": "queue", "to": "worker", "label": "consumes", "variant": "dashed" },
    { "from": "worker", "to": "db", "label": "writes" },
    { "from": "worker", "to": "email", "label": "sends" }
  ]
}
